{
  "schema_version": 1,
  "logical_id": "rerank/cross-encoder/ms-marco-minilm-l6-v2",
  "source": {
    "provider": "huggingface",
    "repository": "cross-encoder/ms-marco-MiniLM-L6-v2",
    "discovery_ref": "233902d25c440f23af6f7d6e94d2946bac0bee0a"
  },
  "license_policy": {
    "allowed_spdx_ids": [
      "Apache-2.0"
    ],
    "require_redistributable": true,
    "allow_custom": false,
    "allow_gated": false
  },
  "artifact": {
    "family": "rerank/cross-encoder",
    "format": "safetensors",
    "expected_file_patterns": [
      "config.json",
      "model.safetensors",
      "special_tokens_map.json",
      "tokenizer.json",
      "tokenizer_config.json",
      "vocab.txt"
    ],
    "max_unpacked_bytes": 150000000
  },
  "validator_profile": "cross-encoder-msmarco-ranking-smoke-v1",
  "redistribution_notices": [
    "Source: https://huggingface.co/cross-encoder/ms-marco-MiniLM-L6-v2",
    "Observed source license metadata: Apache-2.0"
  ],
  "promotion_policy": {
    "mode": "review-required"
  }
}
