{
  "schema_version": 1,
  "logical_id": "vision/siglip2/base-patch16-224",
  "source": {
    "provider": "huggingface",
    "repository": "google/siglip2-base-patch16-224",
    "discovery_ref": "75de2d55ec2d0b4efc50b3e9ad70dba96a7b2fa2"
  },
  "license_policy": {
    "allowed_spdx_ids": ["Apache-2.0"],
    "require_redistributable": true,
    "allow_custom": false,
    "allow_gated": false
  },
  "artifact": {
    "family": "siglip2-transformers",
    "format": "huggingface-safetensors-bundle",
    "expected_file_patterns": [
      "config.json",
      "model.safetensors",
      "preprocessor_config.json",
      "tokenizer.json",
      "tokenizer.model",
      "tokenizer_config.json"
    ],
    "max_unpacked_bytes": 2684354560
  },
  "validator_profile": "siglip2-retrieval-v0-prep",
  "redistribution_notices": [
    "Prepared source declaration only. Harvesting, publication, compatibility validation, approval, and consumer promotion require separate evidence and review."
  ],
  "promotion_policy": {
    "mode": "review-required"
  }
}
